{
  "slots": [
    {
      "slotId": "lamp",
      "slotName": "Лампа",
      "assigned": false,
      "assignedProjectId": null,
      "project": null
    },
    {
      "slotId": "mug",
      "slotName": "Кружка",
      "assigned": false,
      "assignedProjectId": null,
      "project": null
    },
    {
      "slotId": "compass",
      "slotName": "Компас",
      "assigned": false,
      "assignedProjectId": null,
      "project": null
    },
    {
      "slotId": "photos",
      "slotName": "Две фотографии",
      "assigned": false,
      "assignedProjectId": null,
      "project": null
    },
    {
      "slotId": "magnifier",
      "slotName": "Лупа",
      "assigned": false,
      "assignedProjectId": null,
      "project": null
    },
    {
      "slotId": "pencilcup",
      "slotName": "Стакан с карандашами",
      "assigned": false,
      "assignedProjectId": null,
      "project": null
    }
  ],
  "trackers": [
    {
      "id": "tracker-01",
      "type": "tracker",
      "drawerId": "modal-tracker-01",
      "name": "Таск-трекер",
      "badge": "РАБОЧИЙ ПРОДУКТ",
      "badgeClass": "badge-blue",
      "status": "published",
      "lead": "Веб-трекер задач для небольших сервисных команд: роли, дедлайны, комментарии. Учебный проект, описание дорабатывается.",
      "desc": "Внутренний инструмент управления задачами, спринтами и фокусом для соло-разработчиков.",
      "catalogBadge": "ТРЕКЕР",
      "catalogDesc": "Таск-трекер для небольших сервисных команд: роли доступа, дедлайны, комментарии и история изменений.",
      "url": "https://tracker-01.gonka.blog/",
      "urlTitle": "Перейти в таск-трекер (tracker-01.gonka.blog)",
      "telegram": "https://t.me/lonelysvobodny",
      "screenPreview": "/previews/preview-tracker01.jpg",
      "screenBadge": "tracker-01.gonka.blog",
      "caption": "Интерфейс таск-трекера // tracker-01.gonka.blog",
      "chipLabel": "TRK",
      "headerTag": "[ ТРЕКЕР // TASK-TRACKER ]",
      "heroStatus": "● ДЕЙСТВУЮЩИЙ ПРОДУКТ",
      "actions": [
        "ОТКРЫТЬ ТАСК-ТРЕКЕР ↗",
        "СВЯЗАТЬСЯ В TELEGRAM ↗",
        "← К СТОЛУ"
      ],
      "blocks": [
        {
          "heading": "// ДЛЯ КОГО И ЗАЧЕМ",
          "text": "Трекер для небольших сервисных служб: выгул и передержка животных, клининг, локальные команды. Помогает вести задачи без путаницы в мессенджерах и без дорогой подписки на корпоративные системы."
        },
        {
          "heading": "// ЧТО СДЕЛАНО",
          "items": [
            "Роли доступа: администратор, руководитель, сотрудник.",
            "Дедлайны, приоритеты и подсветка просроченных задач.",
            "Комментарии к карточкам, ссылки и история изменений."
          ]
        },
        {
          "heading": "// ПАРАМЕТРЫ",
          "specs": [
            [
              "Статус:",
              "Учебный проект, в работе"
            ],
            [
              "Стек:",
              "Уточняется"
            ],
            [
              "Доступ:",
              "tracker-01.gonka.blog"
            ]
          ]
        },
        {
          "heading": "// РЕЗУЛЬТАТ",
          "result": "Рабочая версия доступна по адресу tracker-01.gonka.blog; описание дорабатывается."
        }
      ]
    },
    {
      "id": "tracker-02",
      "type": "tracker",
      "drawerId": "modal-tracker-02",
      "name": "TaskFlow",
      "badge": "РАБОЧИЙ ПРОДУКТ",
      "badgeClass": "badge-blue",
      "status": "published",
      "lead": "TaskFlow — это интуитивная система для командной работы. Помогает не терять задачи, контролировать дедлайны и видеть общую картину проекта.",
      "desc": "Интуитивная система для командной работы: задачи, дедлайны, сотрудники и общая картина проекта.",
      "catalogBadge": "ТРЕКЕР",
      "catalogDesc": "TaskFlow — система для командной работы. Помогает контролировать дедлайны, распределять задачи и видеть общую картину проекта.",
      "url": "https://tracker-02.gonka.blog/",
      "urlTitle": "Перейти в TaskFlow (tracker-02.gonka.blog)",
      "telegram": "https://t.me/lonelysvobodny",
      "screenPreview": "/previews/tracker2-a6e7fa17.png",
      "screenBadge": "tracker-02.gonka.blog",
      "caption": "Интерфейс TaskFlow // tracker-02.gonka.blog",
      "chipLabel": "TRK",
      "headerTag": "[ ТРЕКЕР // TASKFLOW ]",
      "heroStatus": "● ДЕЙСТВУЮЩИЙ ПРОДУКТ",
      "actions": [
        "ОТКРЫТЬ TASKFLOW ↗",
        "СВЯЗАТЬСЯ В TELEGRAM ↗",
        "← К СТОЛУ"
      ],
      "blocks": [
        {
          "heading": "// ДЛЯ КОГО И ЗАЧЕМ",
          "text": "TaskFlow — это интуитивная система для командной работы. Помогает не терять задачи, контролировать дедлайны и видеть общую картину проекта."
        },
        {
          "heading": "// РАЗДЕЛЫ СИСТЕМЫ",
          "items": [
            "Дашборд — главный экран и сводка по ключевым показателям.",
            "Задачи — полный список задач, фильтрация по статусам, категориям и исполнителям.",
            "Проекты — управление группами задач и этапами.",
            "Команда — список сотрудников, роли и их текущая загрузка.",
            "Отчеты — аналитика продуктивности и сводки по срокам.",
            "Настройки — параметры системы и профиля."
          ]
        },
        {
          "heading": "// ПАРАМЕТРЫ",
          "specs": [
            [
              "Статус:",
              "Рабочий продукт"
            ],
            [
              "Стек:",
              "Web / Vue / Node.js"
            ],
            [
              "Доступ:",
              "tracker-02.gonka.blog"
            ]
          ]
        },
        {
          "heading": "// РЕЗУЛЬТАТ",
          "result": "Действующая система доступна по адресу tracker-02.gonka.blog."
        }
      ]
    }
  ],
  "landings": [
    {
      "id": "english-teacher",
      "type": "landing",
      "name": "English Teacher",
      "badge": "ЛЕНДИНГ",
      "catalogBadge": "ЛЕНДИНГ",
      "status": "published",
      "lead": "Одностраничный сайт частного преподавателя английского языка: подход, форматы занятий и запись на вводный урок.",
      "catalogDesc": "Лендинг частного преподавателя английского языка: методика, форматы занятий, форма записи на вводный урок.",
      "url": "https://english.gonka.blog",
      "telegram": "https://t.me/lonelysvobodny",
      "screenPreview": "/previews/preview-english-teacher.jpg",
      "screenBadge": "english.gonka.blog",
      "caption": "РЕАЛЬНЫЙ ПЕРВЫЙ ЭКРАН // english.gonka.blog",
      "chipLabel": "ENG",
      "headerTag": "[ АРХИВ // ENGLISH TEACHER ]",
      "heroStatus": "● СТАТУС: ЛЕНДИНГ ГОТОВ",
      "actions": [
        "ОТКРЫТЬ ЛЕНДИНГ ↗",
        "СВЯЗАТЬСЯ В TELEGRAM ↗",
        "← К КАТАЛОГУ САЙТОВ"
      ],
      "blocks": [
        {
          "heading": "// О ПРОЕКТЕ",
          "text": "Лендинг для частного преподавателя разговорного английского. Задача — объяснить, чем занятия отличаются от школьных курсов, и дать будущему ученику простой шаг: записаться на вводный урок."
        },
        {
          "heading": "// ЧТО СДЕЛАНО",
          "items": [
            "Структура сайта: позиционирование, форматы уроков, подход к обучению.",
            "Спокойный академический дизайн с упором на читаемость.",
            "Форма записи на консультацию: заявка попадает в Google Таблицу через Google Apps Script.",
            "Адаптивная вёрстка под экран смартфона."
          ]
        },
        {
          "heading": "// ТЕХНИЧЕСКИЕ ПАРАМЕТРЫ",
          "specs": [
            [
              "Тип проекта:",
              "Одностраничный лендинг"
            ],
            [
              "Стек:",
              "HTML5, CSS3, JavaScript"
            ],
            [
              "Форма заявки:",
              "Google Apps Script"
            ],
            [
              "Хранение заявок:",
              "Google Таблицы"
            ],
            [
              "Адаптивность:",
              "Mobile first"
            ],
            [
              "Статус:",
              "Учебный проект"
            ]
          ]
        },
        {
          "heading": "// РЕЗУЛЬТАТ",
          "result": "Лендинг свёрстан, форма записи подключена, сайт опубликован: english.gonka.blog."
        }
      ]
    },
    {
      "id": "twohearts",
      "type": "landing",
      "name": "TwoHearts",
      "badge": "ДЕЙТИНГ-ЛЕНДИНГ",
      "catalogBadge": "ДЕЙТИНГ",
      "status": "published",
      "lead": "Лендинг камерных офлайн-вечеров знакомств на Патриарших прудах: концепция, расписание, бронирование места.",
      "catalogDesc": "Атмосферный лендинг камерных вечеров знакомств в Москве: концепция встреч, правила, ближайшие даты и бронирование.",
      "url": "https://twohearts.gonka.blog",
      "telegram": "https://t.me/lonelysvobodny",
      "screenPreview": "/previews/preview-twohearts.jpg",
      "screenBadge": "twohearts.gonka.blog",
      "caption": "РЕАЛЬНЫЙ ПЕРВЫЙ ЭКРАН // twohearts.gonka.blog",
      "chipLabel": "2H",
      "headerTag": "[ АРХИВ // TWOHEARTS ]",
      "heroStatus": "● СТАТУС: ЛЕНДИНГ ГОТОВ",
      "actions": [
        "ОТКРЫТЬ ЛЕНДИНГ ↗",
        "СВЯЗАТЬСЯ В TELEGRAM ↗",
        "← К КАТАЛОГУ САЙТОВ"
      ],
      "blocks": [
        {
          "heading": "// О ПРОЕКТЕ",
          "text": "Страница камерных вечеров знакомств в Москве, на Патриарших прудах. Задача — передать атмосферу живого общения и предложить спокойную альтернативу приложениям для знакомств."
        },
        {
          "heading": "// ЧТО СДЕЛАНО",
          "items": [
            "Кинематографичная подача: вечерняя Москва, тёплый ресторанный свет.",
            "Описание концепции встреч, правил участия и ближайших дат.",
            "Форма бронирования места на вечер.",
            "Мобильная адаптация."
          ]
        },
        {
          "heading": "// ТЕХНИЧЕСКИЕ ПАРАМЕТРЫ",
          "specs": [
            [
              "Тип проекта:",
              "Event-лендинг с бронированием"
            ],
            [